PMID,Title,Authors,Citation,First Author,Journal/Book,Publication Year,Create Date,PMCID,NIHMS ID,DOI
"39705413","Dietary salt intake is not associated with risk of stroke: A Mendelian randomization study","Zhang X, Tan R, Jia X, Wu X, Sun H, Xue L, Qi C, Yang Y, Wang Z.","Medicine (Baltimore). 2024 Dec 20;103(51):e40622. doi: 10.1097/MD.0000000000040622.","Zhang X","Medicine (Baltimore)","2024","2024/12/20","PMC11666151","","10.1097/MD.0000000000040622"
"38466796","Inhibition of sodium-glucose cotransporter-2 and liver-related complications in individuals with diabetes: a Mendelian randomization and population-based cohort study","Chung SW, Moon HS, Shin H, Han H, Park S, Cho H, Park J, Hur MH, Park MK, Won SH, Lee YB, Cho EJ, Yu SJ, Kim DK, Yoon JH, Lee JH, Kim YJ.","Hepatology. 2024 Sep 1;80(3):633-648. doi: 10.1097/HEP.0000000000000837. Epub 2024 Mar 11.","Chung SW","Hepatology","2024","2024/03/11","","","10.1097/HEP.0000000000000837"
"38739172","Metabolomics signature of blood pressure salt sensitivity and its link to cardiovascular disease: A dietary salt-intervention trial","Lin Z, Li J, Liu F, Cao J, Chen S, Chen J, Huang K, Wang Y, Li H, Wang Y, Huang J, Gu D, Lu X.","Sci China Life Sci. 2024 Aug;67(8):1666-1675. doi: 10.1007/s11427-023-2507-9. Epub 2024 May 9.","Lin Z","Sci China Life Sci","2024","2024/05/13","","","10.1007/s11427-023-2507-9"
"38344244","Sodium intake and the risk of heart failure and hypertension: epidemiological and Mendelian randomization analysis","Yuan M, Yan D, Wang Y, Qi M, Li K, Lv Z, Gao D, Ning N.","Front Nutr. 2024 Jan 26;10:1263554. doi: 10.3389/fnut.2023.1263554. eCollection 2023.","Yuan M","Front Nutr","2024","2024/02/12","PMC10853369","","10.3389/fnut.2023.1263554"
"38188872","Sodium intake and the risk of various types of cardiovascular diseases: a Mendelian randomization study","Fu Q, Chen R, Ding Y, Xu S, Huang C, He B, Jiang T, Zeng B, Bao M, Li S.","Front Nutr. 2023 Dec 22;10:1250509. doi: 10.3389/fnut.2023.1250509. eCollection 2023.","Fu Q","Front Nutr","2023","2024/01/08","PMC10771828","","10.3389/fnut.2023.1250509"
"36235643","SNPs in lncRNA KCNQ1OT1 Modulate Its Expression and Confer Susceptibility to Salt Sensitivity of Blood Pressure in a Chinese Han Population","Xie Y, Qi H, Peng W, Li B, Wen F, Zhang F, Zhang L.","Nutrients. 2022 Sep 26;14(19):3990. doi: 10.3390/nu14193990.","Xie Y","Nutrients","2022","2022/10/14","PMC9571541","","10.3390/nu14193990"
"35885821","Urinary Sodium Excretion Enhances the Effect of Alcohol on Blood Pressure","Jiang X, Anasanti MD, Drenos F, Blakemore AI, Pazoki R.","Healthcare (Basel). 2022 Jul 13;10(7):1296. doi: 10.3390/healthcare10071296.","Jiang X","Healthcare (Basel)","2022","2022/07/27","PMC9319523","","10.3390/healthcare10071296"
"33004230","Impact of urinary sodium on cardiovascular disease and risk factors: A 2 sample Mendelian randomization study","Au Yeung SL, Schooling CM.","Clin Nutr. 2021 Apr;40(4):1990-1996. doi: 10.1016/j.clnu.2020.09.018. Epub 2020 Sep 17.","Au Yeung SL","Clin Nutr","2021","2020/10/02","","","10.1016/j.clnu.2020.09.018"
"32008434","Urinary Albumin, Sodium, and Potassium and Cardiovascular Outcomes in the UK Biobank: Observational and Mendelian Randomization Analyses","Zanetti D, Bergman H, Burgess S, Assimes TL, Bhalla V, Ingelsson E.","Hypertension. 2020 Mar;75(3):714-722. doi: 10.1161/HYPERTENSIONAHA.119.14028. Epub 2020 Feb 3.","Zanetti D","Hypertension","2020","2020/02/04","PMC8032218","","10.1161/HYPERTENSIONAHA.119.14028"
